{
	"$schema": "https://raw.githubusercontent.com/shiptest-ss13/Shiptest/master/_maps/ship_config_schema.json",
	"map_name": "Rigoureux(D)-class Auxiliary Cutter",
	"map_short_name": "Rigoureux(D)-class",
	"map_path": "_maps/shuttles/shiptest/independent_rigger_c.dmm",
	"job_slots": {
		"Captain": {
			"outfit": "/datum/outfit/job/captain/solgov/rebel",
			"officer": true,
			"slots": 1
		},
		"Executive Officer": {
			"outfit": "/datum/outfit/job/head_of_personnel/solgov/rebel",
			"officer": true,
			"slots": 1
		},
		"Signal Officer": {
			"outfit": "/datum/outfit/job/solgov/rebel",
			"officer": true,
			"slots": 1
		},
		"Naval Surgeon": {
			"outfit": "/datum/outfit/job/doctor/solgov/rebel",
			"slots": 1
		},
		"Machinist": {
			"outfit": "/datum/outfit/job/engineer/solgov/rebel",
			"slots": 2
		},
		"Field Engineer": {
			"outfit": "/datum/outfit/job/miner/solgov/rebel",
			"slots": 2
		},
		"Cook": 1,
		"Boarding Specialist": {
			"outfit": "/datum/outfit/job/security/solgov/rebel",
			"slots": 3
		},
		"Sailor": {
			"outfit": "/datum/outfit/job/assistant/solgov/rebel",
			"slots": 4
		}
	},
	"enabled": true
}
