{
	"$schema": "https://raw.githubusercontent.com/shiptest-ss13/Shiptest/master/_maps/ship_config_schema.json",
	"map_name": "Bubble-class Colonial Ship",
	"map_short_name": "Bubble-class",
	"map_path": "_maps/shuttles/shiptest/independent_bubble.dmm",
	"limit": 1,
	"job_slots": {
		"Captain": 1,
		"Scientist": 1,
		"Station Engineer": 1,
		"Shaft Miner": 1,
		"Assistant": 3
	},
	"enabled": false
}
