{
	"$schema": "https://raw.githubusercontent.com/shiptest-ss13/Shiptest/master/_maps/ship_config_schema.json",
	"map_name": "Solar-class Research Vessel",
	"map_short_name": "Solar-class",
	"map_path": "_maps/shuttles/shiptest/independent_solar.dmm",
	"prefix": "ISV",
	"namelists": ["SPACE", "GENERAL"],
	"job_slots": {
		"Captain": 1,
		"Head of Personnel": 1,
		"Medical Doctor": 2,
		"Station Engineer": 3,
		"Shaft Miner": 2,
		"Cargo Technician": 2,
		"Security Officer": 1,
		"Assistant": 5
	},
	"enabled": true
}
