{
	"$schema": "https://raw.githubusercontent.com/shiptest-ss13/Shiptest/master/_maps/ship_config_schema.json",
	"map_name": "Libertatia-class Hauler",
	"map_short_name": "Libertatia-class",
	"map_path": "_maps/shuttles/shiptest/pirate_libertatia.dmm",
	"prefix": "ISV",
	"namelists": ["PIRATES", "NATURAL_AGGRESSIVE"],
	"job_slots": {
		"Captain": {
			"outfit": "/datum/outfit/job/captain/pirate",
			"officer": true,
			"slots": 1
		},
		"First Mate": {
			"outfit": "/datum/outfit/job/head_of_personnel/pirate",
			"officer": true,
			"slots": 1
		},
		"Buccaneer": {
			"outfit": "/datum/outfit/job/security/pirate",
			"slots": 2
		},
		"Motorman": {
			"outfit": "/datum/outfit/job/engineer/pirate",
			"slots": 1
		},
		"Ship's Doctor": {
			"outfit": "/datum/outfit/job/doctor/pirate",
			"slots": 1
		},
		"Deckhand": {
			"outfit": "/datum/outfit/job/assistant/pirate",
			"slots": 4
		}
	},
	"enabled": false
}
