{
	"$schema": "https://raw.githubusercontent.com/shiptest-ss13/Shiptest/master/_maps/ship_config_schema.json",
	"map_name": "Shepherd-Class Space Monastery",
	"map_short_name": "Shepherd-class",
	"map_path": "_maps/shuttles/shiptest/independent_shepherd.dmm",
	"prefix": "ISV",
	"namelists": [
		"MYTHOLOGICAL"
	],
	"job_slots": {
		"Chaplain": 1,
		"Curator": 1,
		"Station Engineer": 1,
		"Acolyte": {
			"outfit": "/datum/outfit/job/assistant/intern",
			"slots": 6
		}
	},
	"enabled": true
}
