{
	"$schema": "https://raw.githubusercontent.com/shiptest-ss13/Shiptest/master/_maps/ship_config_schema.json",
	"map_name": "Box-class Hospital Ship",
	"map_short_name": "Box-class",
	"map_path": "_maps/shuttles/shiptest/independent_box.dmm",
	"namelists": [
		"GENERAL",
		"SPACE",
		"NATURAL"
	],
	"prefix": "ISV",
	"job_slots": {
		"Chief Medical Officer": 1,
		"Medical Doctor": {
			"outfit": "/datum/outfit/job/doctor",
			"slots": 3
		},
		"Paramedic": 2,
		"Assistant": 3
	},
	"enabled": true
}
