{
	"$schema": "https://raw.githubusercontent.com/shiptest-ss13/Shiptest/master/_maps/ship_config_schema.json",
	"map_name": "Lagoon-class Cruise Ship",
	"prefix": "ISV",
	"namelists": [
		"CRUISE"
	],
	"map_short_name": "Lagoon-class",
	"map_path": "_maps/shuttles/shiptest/independent_lagoon.dmm",
	"job_slots": {
		"Captain": 1,
		"Cruise Director": {
			"outfit": "/datum/outfit/job/head_of_personnel",
			"slots": 1
		},
		"Security Officer": 2,
		"Medical Doctor": 1,
		"Ship Engineer": {
			"outfit": "/datum/outfit/job/atmos",
			"slots": 1
		},
		"Bartender": 1,
		"Cook": 1,
		"Botanist": 1,
		"Curator": 1,
		"Chaplain": 1,
		"Janitor": 1,
		"Passenger": {
			"outfit": "/datum/outfit/job/assistant/corporate",
			"slots": 10
		}
	},
	"enabled": true
}
